<?xml version="1.0" encoding="UTF-8" ?>
<!DOCTYPE DialogueSequence SYSTEM "Dialogue.dtd">
 
<DialogueSequence>
    <BaseDialogue bg="">
        <Text>Location:^1 ???</Text>
    </BaseDialogue>
    <CharacterDialogue bg="" curr_portrait="">
        <Actor>???</Actor>
        <Text>The order has arrived^2, my lord.^1 Are we ready to begin?</Text>
    </CharacterDialogue>
    <CharacterDialogue bg="" curr_portrait="">
        <Actor>"Lord"</Actor>
        <Text>Meow meow.^1 Meow meow meow?^2 Meow!^1 MEEEEEEEEOW!!!!</Text>
    </CharacterDialogue>
    <CharacterDialogue bg="" curr_portrait="">
        <Actor>???</Actor>
        <Text>As you wish.^1 I shall swiftly make the preparations...</Text>
    </CharacterDialogue>
</DialogueSequence>