<?xml version="1.0" encoding="UTF-8" ?>
<!DOCTYPE DialogueSequence SYSTEM "Dialogue.dtd">
 
<DialogueSequence>
    <BaseDialogue bg="">
        <Text>Location: Digital Media Lab - Headquarters</Text>
    </BaseDialogue>
    <CharacterDialogue>
        <Actor>You</Actor>
        <Text>(Finally, my first day at the Digital Media Lab. They say only the bravest of all can participate in an experiment like this...)</Text>
    </CharacterDialogue>
    <CharacterDialogue>
        <Actor>You</Actor>
        <Text>(I hope I am prepared enough. This is so exciting!)</Text>
    </CharacterDialogue>
    <CharacterDialogue>
        <Actor>Supa Visor</Actor>
        <Text>Ah, there you are! Took you long enough!</Text>
    </CharacterDialogue>
    <CharacterDialogue>
        <Actor>You</Actor>
        <Text>Well, the Deutsche Bahn kind of doesn't expect snow in winter, so the trains were late by merely... 120 minutes.</Text>
    </CharacterDialogue>
    <CharacterDialogue>
        <Actor>Supa Visor</Actor>
        <Text>We have no time for any chit-chat. They have received the order. Now, we need to act and we act fast.</Text>
    </CharacterDialogue>
    <CharacterDialogue>
        <Actor>You</Actor>
        <Text>Okay, what is it that I should do? You were so secretive in the flyer.</Text>
    </CharacterDialogue>
    <CharacterDialogue>
        <Actor>Supa Visor</Actor>
        <Text>A special assignment, a special case. We successfully infiltrated a robot at this restaurant "The Orange Kitten".</Text>
    </CharacterDialogue>
    <CharacterDialogue>
        <Actor>You</Actor>
        <Text>Ohhh, I've heard about it. They make very delicious food! One time, I ate so much, I actually vom-</Text>
    </CharacterDialogue>
    <CharacterDialogue>
        <Actor>Supa Visor</Actor>
        <Text>TOO. MANY. DETAILS!!</Text>
    </CharacterDialogue>
    <CharacterDialogue>
        <Actor>Supa Visor</Actor>
        <Text>Regardless, you are here today to work with the robot we've infiltrated there. We need to know the secret behind the tasty recipes.</Text>
    </CharacterDialogue>
</DialogueSequence>