<?xml version="1.0" encoding="UTF-8" ?>
<!DOCTYPE DialogueSequence SYSTEM "Dialogue.dtd">

<DialogueSequence>
    <CharacterDialogue bg="" curr_portrait="">
        <Actor>Supervisor</Actor>
        <Text>I believe there are still problems to be solved,^2 though...</Text>
    </CharacterDialogue>
    <CharacterDialogue bg="" curr_portrait="">
        <Actor>Supervisor</Actor>
        <Text>And I'm not even talking about logical mistakes the robot has made,^2 but rather...</Text>
    </CharacterDialogue>
    <CharacterDialogue bg="" curr_portrait="">
        <Actor>Supervisor</Actor>
        <Text>... unusual steps the robot took.^1 Maybe you should ask about those next.</Text>
    </CharacterDialogue>
    <CharacterDialogue bg="" curr_portrait="">
        <Actor>Supervisor</Actor>
        <Text>After all,^2 we need to make sure not to copy those steps in the end.^1 Understood?</Text>
    </CharacterDialogue>
    <CharacterDialogue bg="" curr_portrait="">
        <Actor>You</Actor>
        <Text>Very well,^2 what do I need to do?</Text>
    </CharacterDialogue>
</DialogueSequence>