<?xml version="1.0" encoding="UTF-8" ?>
<!DOCTYPE DialogueSequence SYSTEM "Dialogue.dtd">

<DialogueSequence>
    <CharacterDialogue>
        <Actor>You</Actor>
        <Text>There seems to be a problem with this statement!</Text>
    </CharacterDialogue>
    <CharacterDialogue>
        <Actor>Supervisor</Actor>
        <Text>Hmm, are you sure? That statement sounds perfectly reasonable.</Text>
    </CharacterDialogue>
    <CharacterDialogue>
        <Actor>You</Actor>
        <Text>ARGH! You're right!</Text>
    </CharacterDialogue>
    <CharacterDialogue>
        <Actor>Supervisor</Actor>
        <Text>Think about what you learned so far. Are the conditions under which this dish was made truly okay?</Text>
    </CharacterDialogue>
</DialogueSequence>